S.NO,SiteName,Site_Address_1,Site_Address_2,Site_Address_3,City,State,PostCode,Combined_Address,Standardized_Address_formatted,Standardized_Address_street_number,Standardized_Address_street_name,Standardized_Address_street_type,Standardized_Address_unit_type,Standardized_Address_unit_number,Standardized_Address_city,Standardized_Address_state,Standardized_Address_postal_code,Standardized_Address_country,Standardized_Address_confidence,Standardized_Address_issues,Standardized_Address_status,Standardized_Address_api_source,Standardized_Address_latitude,Standardized_Address_longitude,Standardized_Address_address_id,Standardized_Address_from_cache
1,Hostway Ltd-ST001981,John Lang 2 Harbour Exchange Square Docklands London E14 9GE,,,,,,John Lang 2 Harbour Exchange Square Docklands London E14 9GE,"2 Harbour Exchange Square, Docklands, London, E14 9GE, United Kingdom",2,Harbour Exchange Square,,,,,,London,England,United Kingdom,,success,None_cached,,E14 9GE,8,Yes
2,Infusion-ST013156,7th Floor  2 Harbour Exchange Square,,,London,,E14 9GE,"7th Floor  2 Harbour Exchange Square, London, E14 9GE","7th Floor, 2 Harbour Exchange Square, London, E14 9GE, United Kingdom",2,Harbour Exchange Square,,Floor,7,,,London,England,United Kingdom,,success,None_cached,,E14 9GE,9,Yes
3,Interfleet Technologies Ltd-ST002155,Suite 9.03 Exchange Tower 1 Harbour Exchange Square,,,London,,E14 9GE,"Suite 9.03 Exchange Tower 1 Harbour Exchange Square, London, E14 9GE","Suite 9.03, Exchange Tower, 1 Harbour Exchange Square, London, E14 9GE, United Kingdom",1,Harbour Exchange Square,,Suite,9.03,,,London,England,United Kingdom,,success,None_cached,,E14 9GE,10,Yes
4,Johnson Controls-ST002347,Pilgrims House Unit 3  Links Business Centre Old Woking Road  Surrey GU22 8BF,,,,,GU22 8BF,"Pilgrims House Unit 3  Links Business Centre Old Woking Road  Surrey GU22 8BF, GU22 8BF","Unit 3, Pilgrims House, Links Business Centre, Old Woking Road, Surrey, GU22 8BF, United Kingdom",,Old Woking Road,Road,Unit,3,,,Woking,England,United Kingdom,,success,None_cached,,GU22 8BF,11,Yes
5,Keble House,Keble House  Southernhay Gardens. Exeter,,,,,EX1 1NT,"Keble House  Southernhay Gardens. Exeter, EX1 1NT","Keble House, Southernhay Gardens, Exeter, EX1 1NT, United Kingdom",,Southernhay Gardens,Gardens,,,,,Exeter,England,United Kingdom,,success,None_cached,,EX1 1NT,12,Yes
6,NO.3 BRINDLEY PLACE-ST033509,c/o GVA GRIMLEY PMA321  PO BOX 8790,,,Birmingham,,B1 2JJ,"c/o GVA GRIMLEY PMA321  PO BOX 8790, Birmingham, B1 2JJ","P.O. Box 8790, Birmingham, B1 2JJ, United Kingdom",,,,,,,,Birmingham,England,United Kingdom,,success,None_cached,,B1 2JJ,13,Yes
7,Lethbridge-484 Wt Hill Blvd S,484 Wt Hill Blvd S, , ,Lethbridge,AB,T1J 4Z9,"484 Wt Hill Blvd S, Lethbridge, AB, T1J 4Z9","484 West Hill Boulevard South, Lethbridge, AB T1J 4Z9, Canada",484,West Hill Boulevard,Boulevard,,,,,Lethbridge,AB,Canada,,success,None_cached,,T1J 4Z9,14,Yes
8,Osttra - Gurgaon,DLF Cyber City,Building Number -6, ,Gurgaon,HR,122002,"DLF Cyber City, Building Number -6, Gurgaon, HR, 122002","DLF Cyber City, Building Number 6, Gurgaon, Haryana 122002, India",,DLF Cyber City,,Building Number,6,,,Gurgaon,Haryana,India,,success,None_cached,,122002,15,Yes
